date,title,slug,region,healthcare_focus,it_focus,angle,primary_keyword,secondary_keyword,target_url
2026-03-27,Glasfaserausbau in Euskirchen: Was Kommunen jetzt wissen muessen,euskirchen-glasfaserausbau-kommunen-praxischeck,Euskirchen,Kommunen,Glasfaserausbau,Praxischeck,Technologie Eifel,Breitbandausbau Eifel,/blog/euskirchen-glasfaserausbau-kommunen-praxischeck/
2026-03-28,Tourismusbetriebe in Monschau: Leitfaden fuer Cyberabwehr gegen Phishing,monschau-cyberabwehr-gegen-phishing-tourismusbetriebe-betriebsorganisation,Monschau,Tourismusbetriebe,Cyberabwehr gegen Phishing,Betriebsorganisation,Digitalisierung Eifel,Digitale Infrastruktur Eifel,/blog/monschau-cyberabwehr-gegen-phishing-tourismusbetriebe-betriebsorganisation/
2026-03-29,"Energie-Monitoring in der Region Pruem: Chancen, Risiken und naechste Schritte fuer Gesundheitseinrichtungen",pruem-energie-monitoring-gesundheitseinrichtungen-datenstrategie,Pruem,Gesundheitseinrichtungen,Energie-Monitoring,Datenstrategie,Innovation Eifel,IT-Standort Eifel,/blog/pruem-energie-monitoring-gesundheitseinrichtungen-datenstrategie/
2026-03-30,5G- und Campusnetze in Gerolstein: Kooperationsmodelle fuer Mittelstand,gerolstein-5g-und-campusnetze-mittelstand-kooperationsmodelle,Gerolstein,Mittelstand,5G- und Campusnetze,Kooperationsmodelle,Technologie Eifel,Smart Region Eifel,/blog/gerolstein-5g-und-campusnetze-mittelstand-kooperationsmodelle/
2026-03-31,Energieprojekte und Datenschutz nach DSGVO in Kall: 7 konkrete Handlungsfelder,kall-datenschutz-nach-dsgvo-energieprojekte-nachhaltigkeit,Kall,Energieprojekte,Datenschutz nach DSGVO,Nachhaltigkeit,Digitalisierung Eifel,Breitbandausbau Eifel,/blog/kall-datenschutz-nach-dsgvo-energieprojekte-nachhaltigkeit/
2026-04-01,Telemedizinische Infrastruktur in Heimbach: Was Industriebetriebe jetzt wissen muessen,heimbach-telemedizinische-infrastruktur-industriebetriebe-resilienz-und-krisenvorsorge,Heimbach,Industriebetriebe,Telemedizinische Infrastruktur,Resilienz und Krisenvorsorge,Innovation Eifel,Digitale Infrastruktur Eifel,/blog/heimbach-telemedizinische-infrastruktur-industriebetriebe-resilienz-und-krisenvorsorge/
2026-04-02,Startups in Euskirchen: Leitfaden fuer IT-Sicherheit und Incident Response,euskirchen-it-sicherheit-und-incident-response-startups-standortentwicklung,Euskirchen,Startups,IT-Sicherheit und Incident Response,Standortentwicklung,Technologie Eifel,IT-Standort Eifel,/blog/euskirchen-it-sicherheit-und-incident-response-startups-standortentwicklung/
2026-04-03,"Digitale Verwaltungsprozesse in der Region Monschau: Chancen, Risiken und naechste Schritte fuer Logistik und Mobilitaet",monschau-digitale-verwaltungsprozesse-logistik-und-mobilitaet-personal-und-fachkraefteblick,Monschau,Logistik und Mobilitaet,digitale Verwaltungsprozesse,Personal- und Fachkraefteblick,Digitalisierung Eifel,Smart Region Eifel,/blog/monschau-digitale-verwaltungsprozesse-logistik-und-mobilitaet-personal-und-fachkraefteblick/
2026-04-04,Low-Code-Automatisierung in Pruem: Sicherheits- und Datenschutzperspektive fuer Buergerinitiativen,pruem-low-code-automatisierung-buergerinitiativen-sicherheits-und-datenschutzperspektive,Pruem,Buergerinitiativen,Low-Code-Automatisierung,Sicherheits- und Datenschutzperspektive,Innovation Eifel,Breitbandausbau Eifel,/blog/pruem-low-code-automatisierung-buergerinitiativen-sicherheits-und-datenschutzperspektive/
2026-04-05,Standortfaktor Gerolstein: Warum Cloud-Migration fuer Handwerksbetriebe strategisch ist,gerolstein-cloud-migration-handwerksbetriebe-foerdermittel-und-finanzierung,Gerolstein,Handwerksbetriebe,Cloud-Migration,Foerdermittel und Finanzierung,Technologie Eifel,Digitale Infrastruktur Eifel,/blog/gerolstein-cloud-migration-handwerksbetriebe-foerdermittel-und-finanzierung/
2026-04-06,Kall: Standortvernetzung als Hebel fuer Vereine und Ehrenamt,kall-standortvernetzung-vereine-und-ehrenamt-kosten-nutzen-betrachtung,Kall,Vereine und Ehrenamt,Standortvernetzung,Kosten-Nutzen-Betrachtung,Digitalisierung Eifel,IT-Standort Eifel,/blog/kall-standortvernetzung-vereine-und-ehrenamt-kosten-nutzen-betrachtung/
2026-04-07,Technologie-Update Heimbach: Geo- und Umweltdaten im Praxischeck fuer Kommunen,heimbach-geo-und-umweltdaten-kommunen-umsetzungsfahrplan,Heimbach,Kommunen,Geo- und Umweltdaten,Umsetzungsfahrplan,Innovation Eifel,Smart Region Eifel,/blog/heimbach-geo-und-umweltdaten-kommunen-umsetzungsfahrplan/
2026-04-08,Euskirchen im Fokus: Wie Tourismusbetriebe mit KI-Anwendungen im Alltag resilienter werden,euskirchen-ki-anwendungen-im-alltag-tourismusbetriebe-praxischeck,Euskirchen,Tourismusbetriebe,KI-Anwendungen im Alltag,Praxischeck,Technologie Eifel,Breitbandausbau Eifel,/blog/euskirchen-ki-anwendungen-im-alltag-tourismusbetriebe-praxischeck/
2026-04-09,Monschau: Einstieg von Gesundheitseinrichtungen in digitale Zwillinge,monschau-digitale-zwillinge-gesundheitseinrichtungen-betriebsorganisation,Monschau,Gesundheitseinrichtungen,digitale Zwillinge,Betriebsorganisation,Digitalisierung Eifel,Digitale Infrastruktur Eifel,/blog/monschau-digitale-zwillinge-gesundheitseinrichtungen-betriebsorganisation/
2026-04-10,Standortfaktor Pruem: Warum Rechenzentrum-Modernisierung fuer Mittelstand strategisch ist,pruem-rechenzentrum-modernisierung-mittelstand-datenstrategie,Pruem,Mittelstand,Rechenzentrum-Modernisierung,Datenstrategie,Innovation Eifel,IT-Standort Eifel,/blog/pruem-rechenzentrum-modernisierung-mittelstand-datenstrategie/
2026-04-11,Gerolstein: Smart-City-Technologien als Hebel fuer Energieprojekte,gerolstein-smart-city-technologien-energieprojekte-kooperationsmodelle,Gerolstein,Energieprojekte,Smart-City-Technologien,Kooperationsmodelle,Technologie Eifel,Smart Region Eifel,/blog/gerolstein-smart-city-technologien-energieprojekte-kooperationsmodelle/
2026-04-12,Technologie-Update Kall: IoT-Sensorik im Praxischeck fuer Industriebetriebe,kall-iot-sensorik-industriebetriebe-nachhaltigkeit,Kall,Industriebetriebe,IoT-Sensorik,Nachhaltigkeit,Digitalisierung Eifel,Breitbandausbau Eifel,/blog/kall-iot-sensorik-industriebetriebe-nachhaltigkeit/
2026-04-13,Vulkaneifel im Fokus: Wie Startups mit Glasfaserausbau resilienter werden,vulkaneifel-glasfaserausbau-startups-resilienz-und-krisenvorsorge,Vulkaneifel,Startups,Glasfaserausbau,Resilienz und Krisenvorsorge,Innovation Eifel,Digitale Infrastruktur Eifel,/blog/vulkaneifel-glasfaserausbau-startups-resilienz-und-krisenvorsorge/
2026-04-14,Logistik und Mobilitaet und Cyberabwehr gegen Phishing in Bad Muenstereifel: 7 konkrete Handlungsfelder,bad-muenstereifel-cyberabwehr-gegen-phishing-logistik-und-mobilitaet-standortentwicklung,Bad Muenstereifel,Logistik und Mobilitaet,Cyberabwehr gegen Phishing,Standortentwicklung,Technologie Eifel,IT-Standort Eifel,/blog/bad-muenstereifel-cyberabwehr-gegen-phishing-logistik-und-mobilitaet-standortentwicklung/
2026-04-15,Energie-Monitoring in Schleiden: Was Buergerinitiativen jetzt wissen muessen,schleiden-energie-monitoring-buergerinitiativen-standortentwicklung,Schleiden,Buergerinitiativen,Energie-Monitoring,Standortentwicklung,Digitalisierung Eifel,Smart Region Eifel,/blog/schleiden-energie-monitoring-buergerinitiativen-standortentwicklung/
2026-04-16,Handwerksbetriebe in Bitburg: Leitfaden fuer 5G- und Campusnetze,bitburg-5g-und-campusnetze-handwerksbetriebe-personal-und-fachkraefteblick,Bitburg,Handwerksbetriebe,5G- und Campusnetze,Personal- und Fachkraefteblick,Innovation Eifel,Breitbandausbau Eifel,/blog/bitburg-5g-und-campusnetze-handwerksbetriebe-personal-und-fachkraefteblick/
2026-04-17,"Datenschutz nach DSGVO in der Region Adenau: Chancen, Risiken und naechste Schritte fuer Vereine und Ehrenamt",adenau-datenschutz-nach-dsgvo-vereine-und-ehrenamt-sicherheits-und-datenschutzperspektive,Adenau,Vereine und Ehrenamt,Datenschutz nach DSGVO,Sicherheits- und Datenschutzperspektive,Technologie Eifel,Digitale Infrastruktur Eifel,/blog/adenau-datenschutz-nach-dsgvo-vereine-und-ehrenamt-sicherheits-und-datenschutzperspektive/
2026-04-18,Telemedizinische Infrastruktur in Nettersheim: Foerdermittel und Finanzierung fuer Kommunen,nettersheim-telemedizinische-infrastruktur-kommunen-foerdermittel-und-finanzierung,Nettersheim,Kommunen,Telemedizinische Infrastruktur,Foerdermittel und Finanzierung,Digitalisierung Eifel,IT-Standort Eifel,/blog/nettersheim-telemedizinische-infrastruktur-kommunen-foerdermittel-und-finanzierung/
2026-04-19,Tourismusbetriebe und IT-Sicherheit und Incident Response in Vulkaneifel: 7 konkrete Handlungsfelder,vulkaneifel-it-sicherheit-und-incident-response-tourismusbetriebe-kosten-nutzen-betrachtung,Vulkaneifel,Tourismusbetriebe,IT-Sicherheit und Incident Response,Kosten-Nutzen-Betrachtung,Innovation Eifel,Smart Region Eifel,/blog/vulkaneifel-it-sicherheit-und-incident-response-tourismusbetriebe-kosten-nutzen-betrachtung/
2026-04-20,Digitale Verwaltungsprozesse in Bad Muenstereifel: Was Gesundheitseinrichtungen jetzt wissen muessen,bad-muenstereifel-digitale-verwaltungsprozesse-gesundheitseinrichtungen-umsetzungsfahrplan,Bad Muenstereifel,Gesundheitseinrichtungen,digitale Verwaltungsprozesse,Umsetzungsfahrplan,Technologie Eifel,Breitbandausbau Eifel,/blog/bad-muenstereifel-digitale-verwaltungsprozesse-gesundheitseinrichtungen-umsetzungsfahrplan/
2026-04-21,Mittelstand in Schleiden: Leitfaden fuer Low-Code-Automatisierung,schleiden-low-code-automatisierung-mittelstand-praxischeck,Schleiden,Mittelstand,Low-Code-Automatisierung,Praxischeck,Digitalisierung Eifel,Digitale Infrastruktur Eifel,/blog/schleiden-low-code-automatisierung-mittelstand-praxischeck/
2026-04-22,"KI-Anwendungen im Alltag in der Region Bitburg: Chancen, Risiken und naechste Schritte fuer Energieprojekte",bitburg-ki-anwendungen-im-alltag-energieprojekte-betriebsorganisation,Bitburg,Energieprojekte,KI-Anwendungen im Alltag,Betriebsorganisation,Innovation Eifel,IT-Standort Eifel,/blog/bitburg-ki-anwendungen-im-alltag-energieprojekte-betriebsorganisation/
2026-04-23,Adenau: Einstieg von Industriebetriebe in digitale Bildung,adenau-digitale-bildung-industriebetriebe-datenstrategie,Adenau,Industriebetriebe,digitale Bildung,Datenstrategie,Technologie Eifel,Smart Region Eifel,/blog/adenau-digitale-bildung-industriebetriebe-datenstrategie/
2026-04-24,Standortfaktor Nettersheim: Warum E-Government-Schnittstellen fuer Startups strategisch ist,nettersheim-e-government-schnittstellen-startups-kooperationsmodelle,Nettersheim,Startups,E-Government-Schnittstellen,Kooperationsmodelle,Digitalisierung Eifel,Breitbandausbau Eifel,/blog/nettersheim-e-government-schnittstellen-startups-kooperationsmodelle/
2026-04-25,Vulkaneifel: Open-Data-Initiativen als Hebel fuer Logistik und Mobilitaet,vulkaneifel-open-data-initiativen-logistik-und-mobilitaet-nachhaltigkeit,Vulkaneifel,Logistik und Mobilitaet,Open-Data-Initiativen,Nachhaltigkeit,Innovation Eifel,Digitale Infrastruktur Eifel,/blog/vulkaneifel-open-data-initiativen-logistik-und-mobilitaet-nachhaltigkeit/
2026-04-26,Technologie-Update Bad Muenstereifel: digitale Zwillinge im Praxischeck fuer Buergerinitiativen,bad-muenstereifel-digitale-zwillinge-buergerinitiativen-resilienz-und-krisenvorsorge,Bad Muenstereifel,Buergerinitiativen,digitale Zwillinge,Resilienz und Krisenvorsorge,Technologie Eifel,IT-Standort Eifel,/blog/bad-muenstereifel-digitale-zwillinge-buergerinitiativen-resilienz-und-krisenvorsorge/
2026-04-27,Schleiden im Fokus: Wie Handwerksbetriebe mit Rechenzentrum-Modernisierung resilienter werden,schleiden-rechenzentrum-modernisierung-handwerksbetriebe-standortentwicklung,Schleiden,Handwerksbetriebe,Rechenzentrum-Modernisierung,Standortentwicklung,Digitalisierung Eifel,Smart Region Eifel,/blog/schleiden-rechenzentrum-modernisierung-handwerksbetriebe-standortentwicklung/
2026-04-28,Bitburg: Einstieg von Vereine und Ehrenamt in Smart-City-Technologien,bitburg-smart-city-technologien-vereine-und-ehrenamt-personal-und-fachkraefteblick,Bitburg,Vereine und Ehrenamt,Smart-City-Technologien,Personal- und Fachkraefteblick,Innovation Eifel,Breitbandausbau Eifel,/blog/bitburg-smart-city-technologien-vereine-und-ehrenamt-personal-und-fachkraefteblick/
2026-04-29,Standortfaktor Adenau: Warum IoT-Sensorik fuer Kommunen strategisch ist,adenau-iot-sensorik-kommunen-sicherheits-und-datenschutzperspektive,Adenau,Kommunen,IoT-Sensorik,Sicherheits- und Datenschutzperspektive,Technologie Eifel,Digitale Infrastruktur Eifel,/blog/adenau-iot-sensorik-kommunen-sicherheits-und-datenschutzperspektive/
2026-04-30,Blankenheim: Glasfaserausbau als Hebel fuer Tourismusbetriebe,blankenheim-glasfaserausbau-tourismusbetriebe-foerdermittel-und-finanzierung,Blankenheim,Tourismusbetriebe,Glasfaserausbau,Foerdermittel und Finanzierung,Digitalisierung Eifel,IT-Standort Eifel,/blog/blankenheim-glasfaserausbau-tourismusbetriebe-foerdermittel-und-finanzierung/
2026-05-01,Technologie-Update Eifelkreis Bitburg-Pruem: Cyberabwehr gegen Phishing im Praxischeck fuer Gesundheitseinrichtungen,eifelkreis-bitburg-pruem-cyberabwehr-gegen-phishing-gesundheitseinrichtungen-kosten-nutzen-betrachtung,Eifelkreis Bitburg-Pruem,Gesundheitseinrichtungen,Cyberabwehr gegen Phishing,Kosten-Nutzen-Betrachtung,Innovation Eifel,Smart Region Eifel,/blog/eifelkreis-bitburg-pruem-cyberabwehr-gegen-phishing-gesundheitseinrichtungen-kosten-nutzen-betrachtung/
2026-05-02,Energie-Monitoring in Mechernich: Umsetzungsfahrplan fuer Mittelstand,mechernich-energie-monitoring-mittelstand-umsetzungsfahrplan,Mechernich,Mittelstand,Energie-Monitoring,Umsetzungsfahrplan,Technologie Eifel,Breitbandausbau Eifel,/blog/mechernich-energie-monitoring-mittelstand-umsetzungsfahrplan/
2026-05-03,Energieprojekte und 5G- und Campusnetze in Nideggen: 7 konkrete Handlungsfelder,nideggen-5g-und-campusnetze-energieprojekte-praxischeck,Nideggen,Energieprojekte,5G- und Campusnetze,Praxischeck,Digitalisierung Eifel,Digitale Infrastruktur Eifel,/blog/nideggen-5g-und-campusnetze-energieprojekte-praxischeck/
2026-05-04,Datenschutz nach DSGVO in Daun: Was Industriebetriebe jetzt wissen muessen,daun-datenschutz-nach-dsgvo-industriebetriebe-praxischeck,Daun,Industriebetriebe,Datenschutz nach DSGVO,Praxischeck,Innovation Eifel,IT-Standort Eifel,/blog/daun-datenschutz-nach-dsgvo-industriebetriebe-praxischeck/
2026-05-05,Startups in Mayen: Leitfaden fuer Low-Code-Automatisierung,mayen-low-code-automatisierung-startups-betriebsorganisation,Mayen,Startups,Low-Code-Automatisierung,Betriebsorganisation,Technologie Eifel,Smart Region Eifel,/blog/mayen-low-code-automatisierung-startups-betriebsorganisation/
2026-05-06,"Cloud-Migration in der Region Blankenheim: Chancen, Risiken und naechste Schritte fuer Logistik und Mobilitaet",blankenheim-cloud-migration-logistik-und-mobilitaet-datenstrategie,Blankenheim,Logistik und Mobilitaet,Cloud-Migration,Datenstrategie,Digitalisierung Eifel,Breitbandausbau Eifel,/blog/blankenheim-cloud-migration-logistik-und-mobilitaet-datenstrategie/
2026-05-07,Standortvernetzung in Eifelkreis Bitburg-Pruem: Kooperationsmodelle fuer Buergerinitiativen,eifelkreis-bitburg-pruem-standortvernetzung-buergerinitiativen-kooperationsmodelle,Eifelkreis Bitburg-Pruem,Buergerinitiativen,Standortvernetzung,Kooperationsmodelle,Innovation Eifel,Digitale Infrastruktur Eifel,/blog/eifelkreis-bitburg-pruem-standortvernetzung-buergerinitiativen-kooperationsmodelle/
2026-05-08,Handwerksbetriebe und Geo- und Umweltdaten in Mechernich: 7 konkrete Handlungsfelder,mechernich-geo-und-umweltdaten-handwerksbetriebe-nachhaltigkeit,Mechernich,Handwerksbetriebe,Geo- und Umweltdaten,Nachhaltigkeit,Technologie Eifel,IT-Standort Eifel,/blog/mechernich-geo-und-umweltdaten-handwerksbetriebe-nachhaltigkeit/
2026-05-09,KI-Anwendungen im Alltag in Nideggen: Was Vereine und Ehrenamt jetzt wissen muessen,nideggen-ki-anwendungen-im-alltag-vereine-und-ehrenamt-resilienz-und-krisenvorsorge,Nideggen,Vereine und Ehrenamt,KI-Anwendungen im Alltag,Resilienz und Krisenvorsorge,Digitalisierung Eifel,Smart Region Eifel,/blog/nideggen-ki-anwendungen-im-alltag-vereine-und-ehrenamt-resilienz-und-krisenvorsorge/
2026-05-10,Kommunen in Daun: Leitfaden fuer digitale Bildung,daun-digitale-bildung-kommunen-standortentwicklung,Daun,Kommunen,digitale Bildung,Standortentwicklung,Innovation Eifel,Breitbandausbau Eifel,/blog/daun-digitale-bildung-kommunen-standortentwicklung/
2026-05-11,Mayen im Fokus: Wie Tourismusbetriebe mit E-Government-Schnittstellen resilienter werden,mayen-e-government-schnittstellen-tourismusbetriebe-personal-und-fachkraefteblick,Mayen,Tourismusbetriebe,E-Government-Schnittstellen,Personal- und Fachkraefteblick,Technologie Eifel,Digitale Infrastruktur Eifel,/blog/mayen-e-government-schnittstellen-tourismusbetriebe-personal-und-fachkraefteblick/
2026-05-12,Blankenheim: Einstieg von Gesundheitseinrichtungen in Open-Data-Initiativen,blankenheim-open-data-initiativen-gesundheitseinrichtungen-sicherheits-und-datenschutzperspektive,Blankenheim,Gesundheitseinrichtungen,Open-Data-Initiativen,Sicherheits- und Datenschutzperspektive,Digitalisierung Eifel,IT-Standort Eifel,/blog/blankenheim-open-data-initiativen-gesundheitseinrichtungen-sicherheits-und-datenschutzperspektive/
2026-05-13,Standortfaktor Eifelkreis Bitburg-Pruem: Warum digitale Zwillinge fuer Mittelstand strategisch ist,eifelkreis-bitburg-pruem-digitale-zwillinge-mittelstand-foerdermittel-und-finanzierung,Eifelkreis Bitburg-Pruem,Mittelstand,digitale Zwillinge,Foerdermittel und Finanzierung,Innovation Eifel,Smart Region Eifel,/blog/eifelkreis-bitburg-pruem-digitale-zwillinge-mittelstand-foerdermittel-und-finanzierung/
2026-05-14,Mechernich: Rechenzentrum-Modernisierung als Hebel fuer Energieprojekte,mechernich-rechenzentrum-modernisierung-energieprojekte-kosten-nutzen-betrachtung,Mechernich,Energieprojekte,Rechenzentrum-Modernisierung,Kosten-Nutzen-Betrachtung,Technologie Eifel,Breitbandausbau Eifel,/blog/mechernich-rechenzentrum-modernisierung-energieprojekte-kosten-nutzen-betrachtung/
2026-05-15,Technologie-Update Nideggen: Smart-City-Technologien im Praxischeck fuer Industriebetriebe,nideggen-smart-city-technologien-industriebetriebe-umsetzungsfahrplan,Nideggen,Industriebetriebe,Smart-City-Technologien,Umsetzungsfahrplan,Digitalisierung Eifel,Digitale Infrastruktur Eifel,/blog/nideggen-smart-city-technologien-industriebetriebe-umsetzungsfahrplan/
2026-05-16,Daun im Fokus: Wie Startups mit IoT-Sensorik resilienter werden,daun-iot-sensorik-startups-praxischeck,Daun,Startups,IoT-Sensorik,Praxischeck,Innovation Eifel,IT-Standort Eifel,/blog/daun-iot-sensorik-startups-praxischeck/
2026-05-17,Kall: Einstieg von Logistik und Mobilitaet in Glasfaserausbau,kall-glasfaserausbau-logistik-und-mobilitaet-betriebsorganisation,Kall,Logistik und Mobilitaet,Glasfaserausbau,Betriebsorganisation,Technologie Eifel,Smart Region Eifel,/blog/kall-glasfaserausbau-logistik-und-mobilitaet-betriebsorganisation/
2026-05-18,Standortfaktor Heimbach: Warum Datenschutz nach DSGVO fuer Buergerinitiativen strategisch ist,heimbach-datenschutz-nach-dsgvo-buergerinitiativen-datenstrategie,Heimbach,Buergerinitiativen,Datenschutz nach DSGVO,Datenstrategie,Digitalisierung Eifel,Breitbandausbau Eifel,/blog/heimbach-datenschutz-nach-dsgvo-buergerinitiativen-datenstrategie/
2026-05-19,Euskirchen: Telemedizinische Infrastruktur als Hebel fuer Handwerksbetriebe,euskirchen-telemedizinische-infrastruktur-handwerksbetriebe-kooperationsmodelle,Euskirchen,Handwerksbetriebe,Telemedizinische Infrastruktur,Kooperationsmodelle,Innovation Eifel,Digitale Infrastruktur Eifel,/blog/euskirchen-telemedizinische-infrastruktur-handwerksbetriebe-kooperationsmodelle/
2026-05-20,"IT-Sicherheit und Incident Response in der Region Monschau: Chancen, Risiken und naechste Schritte fuer Vereine und Ehrenamt",monschau-it-sicherheit-und-incident-response-vereine-und-ehrenamt-nachhaltigkeit,Monschau,Vereine und Ehrenamt,IT-Sicherheit und Incident Response,Nachhaltigkeit,Technologie Eifel,IT-Standort Eifel,/blog/monschau-it-sicherheit-und-incident-response-vereine-und-ehrenamt-nachhaltigkeit/
2026-05-21,Digitale Verwaltungsprozesse in Pruem: Resilienz und Krisenvorsorge fuer Kommunen,pruem-digitale-verwaltungsprozesse-kommunen-resilienz-und-krisenvorsorge,Pruem,Kommunen,digitale Verwaltungsprozesse,Resilienz und Krisenvorsorge,Digitalisierung Eifel,Smart Region Eifel,/blog/pruem-digitale-verwaltungsprozesse-kommunen-resilienz-und-krisenvorsorge/
2026-05-22,Tourismusbetriebe und Low-Code-Automatisierung in Gerolstein: 7 konkrete Handlungsfelder,gerolstein-low-code-automatisierung-tourismusbetriebe-standortentwicklung,Gerolstein,Tourismusbetriebe,Low-Code-Automatisierung,Standortentwicklung,Innovation Eifel,Breitbandausbau Eifel,/blog/gerolstein-low-code-automatisierung-tourismusbetriebe-standortentwicklung/
2026-05-23,Cloud-Migration in Kall: Was Gesundheitseinrichtungen jetzt wissen muessen,kall-cloud-migration-gesundheitseinrichtungen-standortentwicklung,Kall,Gesundheitseinrichtungen,Cloud-Migration,Standortentwicklung,Technologie Eifel,Digitale Infrastruktur Eifel,/blog/kall-cloud-migration-gesundheitseinrichtungen-standortentwicklung/
2026-05-24,Mittelstand in Heimbach: Leitfaden fuer Standortvernetzung,heimbach-standortvernetzung-mittelstand-personal-und-fachkraefteblick,Heimbach,Mittelstand,Standortvernetzung,Personal- und Fachkraefteblick,Digitalisierung Eifel,IT-Standort Eifel,/blog/heimbach-standortvernetzung-mittelstand-personal-und-fachkraefteblick/
2026-05-25,"Geo- und Umweltdaten in der Region Euskirchen: Chancen, Risiken und naechste Schritte fuer Energieprojekte",euskirchen-geo-und-umweltdaten-energieprojekte-sicherheits-und-datenschutzperspektive,Euskirchen,Energieprojekte,Geo- und Umweltdaten,Sicherheits- und Datenschutzperspektive,Innovation Eifel,Smart Region Eifel,/blog/euskirchen-geo-und-umweltdaten-energieprojekte-sicherheits-und-datenschutzperspektive/
2026-05-26,KI-Anwendungen im Alltag in Monschau: Foerdermittel und Finanzierung fuer Industriebetriebe,monschau-ki-anwendungen-im-alltag-industriebetriebe-foerdermittel-und-finanzierung,Monschau,Industriebetriebe,KI-Anwendungen im Alltag,Foerdermittel und Finanzierung,Technologie Eifel,Breitbandausbau Eifel,/blog/monschau-ki-anwendungen-im-alltag-industriebetriebe-foerdermittel-und-finanzierung/
2026-05-27,Startups und digitale Bildung in Pruem: 7 konkrete Handlungsfelder,pruem-digitale-bildung-startups-kosten-nutzen-betrachtung,Pruem,Startups,digitale Bildung,Kosten-Nutzen-Betrachtung,Digitalisierung Eifel,Digitale Infrastruktur Eifel,/blog/pruem-digitale-bildung-startups-kosten-nutzen-betrachtung/
2026-05-28,E-Government-Schnittstellen in Gerolstein: Was Logistik und Mobilitaet jetzt wissen muessen,gerolstein-e-government-schnittstellen-logistik-und-mobilitaet-umsetzungsfahrplan,Gerolstein,Logistik und Mobilitaet,E-Government-Schnittstellen,Umsetzungsfahrplan,Innovation Eifel,IT-Standort Eifel,/blog/gerolstein-e-government-schnittstellen-logistik-und-mobilitaet-umsetzungsfahrplan/
2026-05-29,Technologie-Update Kall: Open-Data-Initiativen im Praxischeck fuer Buergerinitiativen,kall-open-data-initiativen-buergerinitiativen-praxischeck,Kall,Buergerinitiativen,Open-Data-Initiativen,Praxischeck,Technologie Eifel,Smart Region Eifel,/blog/kall-open-data-initiativen-buergerinitiativen-praxischeck/
2026-05-30,Heimbach im Fokus: Wie Handwerksbetriebe mit digitale Zwillinge resilienter werden,heimbach-digitale-zwillinge-handwerksbetriebe-betriebsorganisation,Heimbach,Handwerksbetriebe,digitale Zwillinge,Betriebsorganisation,Digitalisierung Eifel,Breitbandausbau Eifel,/blog/heimbach-digitale-zwillinge-handwerksbetriebe-betriebsorganisation/
2026-05-31,Euskirchen: Einstieg von Vereine und Ehrenamt in Glasfaserausbau,euskirchen-glasfaserausbau-vereine-und-ehrenamt-datenstrategie,Euskirchen,Vereine und Ehrenamt,Glasfaserausbau,Datenstrategie,Innovation Eifel,Digitale Infrastruktur Eifel,/blog/euskirchen-glasfaserausbau-vereine-und-ehrenamt-datenstrategie/
2026-06-01,Standortfaktor Monschau: Warum Cyberabwehr gegen Phishing fuer Kommunen strategisch ist,monschau-cyberabwehr-gegen-phishing-kommunen-kooperationsmodelle,Monschau,Kommunen,Cyberabwehr gegen Phishing,Kooperationsmodelle,Technologie Eifel,IT-Standort Eifel,/blog/monschau-cyberabwehr-gegen-phishing-kommunen-kooperationsmodelle/
2026-06-02,Pruem: Energie-Monitoring als Hebel fuer Tourismusbetriebe,pruem-energie-monitoring-tourismusbetriebe-nachhaltigkeit,Pruem,Tourismusbetriebe,Energie-Monitoring,Nachhaltigkeit,Digitalisierung Eifel,Smart Region Eifel,/blog/pruem-energie-monitoring-tourismusbetriebe-nachhaltigkeit/
2026-06-03,Technologie-Update Adenau: 5G- und Campusnetze im Praxischeck fuer Gesundheitseinrichtungen,adenau-5g-und-campusnetze-gesundheitseinrichtungen-resilienz-und-krisenvorsorge,Adenau,Gesundheitseinrichtungen,5G- und Campusnetze,Resilienz und Krisenvorsorge,Innovation Eifel,Breitbandausbau Eifel,/blog/adenau-5g-und-campusnetze-gesundheitseinrichtungen-resilienz-und-krisenvorsorge/
2026-06-04,Nettersheim im Fokus: Wie Mittelstand mit Datenschutz nach DSGVO resilienter werden,nettersheim-datenschutz-nach-dsgvo-mittelstand-standortentwicklung,Nettersheim,Mittelstand,Datenschutz nach DSGVO,Standortentwicklung,Technologie Eifel,Digitale Infrastruktur Eifel,/blog/nettersheim-datenschutz-nach-dsgvo-mittelstand-standortentwicklung/
2026-06-05,Vulkaneifel: Einstieg von Energieprojekte in Telemedizinische Infrastruktur,vulkaneifel-telemedizinische-infrastruktur-energieprojekte-personal-und-fachkraefteblick,Vulkaneifel,Energieprojekte,Telemedizinische Infrastruktur,Personal- und Fachkraefteblick,Digitalisierung Eifel,IT-Standort Eifel,/blog/vulkaneifel-telemedizinische-infrastruktur-energieprojekte-personal-und-fachkraefteblick/
